reviewerID,asin,predictRating,T_v,overall,reviewText,filteredReview
,B0011Z1DPY,1,-1,3,"Pretty much the same as my previous Nickleback song review, you know what you're getting. It's listenable, at least for a few times.",
,B0011Z1DPY,1,-1,3,"I like the band's music.  The only problem I have is that every song is similar.  Admittedlly this could be that I haven't listened to them much and the samples don't really reflect the entire composition.  Good Band, Good Song.",
,B0011Z1DPY,-1,1,5,"I liked this song, but didn't want the whole album. I just searched for the names of this group's songs that I want.",
,B0011Z1BHO,-1,1,5,haave it on my phone to exercise to/ always makes me run faster  definitely R rated/not for kids under 16,
,B0011Z2Y5C,-1,1,5,Not sure why they want this reviewed.. It's a song. I knew what I was getting and that's what I got..  ????,
,B0011Z2Y5C,-1,1,5,Everyone I know has every word of this song memorized.,
,B0011Z2Y5C,-1,1,5,smoof,
,B0011Z310Y,-1,1,5,5 stars,
,B0011Z310Y,-1,1,5,"Very similar to Wind Beneath My Wings. Not familiar with this artist's work, so this is a good intro.",
,B0011Z3GFY,-1,1,5,Was what it is.,
,B0011Z310Y,-1,1,5,Heart felt...,
,B0011Z2Y16,-1,1,5,Remember this on am radio when I was a kid.,
,B0011Z310Y,1,-1,1,GOOD,
,B0011Z3GFY,-1,1,5,classico,
,B0011Z310Y,-1,1,5,Can't beat Josh no voice like his,
,B0011Z3GFY,-1,1,4,k,
,B0011Z2YAC,-1,1,5,Not sure why they want this reviewed..  Its a song.. I knew what I was getting and that's what I got. ????,
,B0011Z3GFY,-1,1,5,claassic,
,B0011Z3GFY,-1,1,5,Eric,
,B0011Z1DEK,-1,1,5,"well, isn't it, still????",
,B0011Z3GFY,-1,1,5,Showing my age,
,B0011Z310Y,-1,1,5,Moving song!,
,B0011Z1BXS,-1,1,5,AAAAA+++++,
,B0011Z1BXS,-1,1,4,1,
,B0011Z1BXS,-1,1,5,:),
,B0011Z1BXS,-1,1,5,Can't help but turn it up!,
,B0011Z1BXS,-1,1,4,I am not much for writing reviews let alone writing more then a few words and don't like it when forced to  so  I liked it.,
,B0011Z1BXS,-1,1,4,I knew the song before i purchased. What can I say?  I like it.  It isn't a song I had so I purchased. it.,
,B0011Z4Z3G,-1,1,5,Eric,
,B0011Z4Z3G,-1,1,4,ok song,
,B0011Z4Z3G,-1,1,5,REMINDS ME OF MY SOPHOMORE YR. IN HS,
,B0011Z310Y,-1,1,5,"I downloaded this song onto my mp3 player on my phone, heard this song on the radio and had to have it for days when filling down.",
,B0011Z4Z3G,1,-1,3,We have always enjoy listening to this music. We put in on play lists for events with family and friends.,
,B0011Z4Z3G,1,-1,3,"This latest effort by Tracy is reminiscent of ""Gove me one reason"" but worth it to hear her fresh sound again.....Tracy is a very talented artist.",
,B0011Z4X9C,1,-1,3,Great song,
,B0011Z2Y7A,-1,1,5,Not sure why they want this reviewed.. It's a song. I knew what I was getting and that's what I got..  ????,
,B0011Z3F8M,-1,1,5,e,
,B0011Z3F8M,1,-1,3,Humorous lyrics....it is rumored that she was talking about James Taylor,
,B0011Z3F8M,1,-1,3,Good song,
,B0011Z4XF6,-1,1,5,Not sure why they want this reviewed.. It's a song. I knew what I was getting and that's what I got..  ????,
,B0011Z4XJ2,-1,1,4,"I must say that I am not particularly familiar with the Goo goo dolls but I really like this cover of Supertramp's ""Give a little bit"". It is a bit more of a rock version with driving guitars and not-so ethereal vocals.",
,B0011Z4XF6,-1,1,5,I really think reviewing songs are worthless. It's a song and if I didn't like it I would not have purchased it.,
,B0011Z4YB4,-1,1,4,Okay,
,B0011Z4YB4,-1,1,5,"A-W-E-S-O-M-E ........... vocals, arrangement, beat, music........the beat",
,B0011Z4YB4,-1,1,5,AH MEMORIES,
,B0011Z5IGE,-1,1,5,"What I've Done
Linkin Park. The band says it all Linkin Park",
,B0011Z5IGE,-1,1,5,"My daughter enjoys listening to this band and is happy with the purchase. Seven more words required, blah, blah, blah!",
,B0011Z1DEU,-1,1,5,IN MY PLAYLIST!,
,B0011Z4YB4,-1,1,5,memories,
,B0011Z5IFK,-1,1,4,"First off, while this song may have a close structure to a certain U2 song, it wouldn't be the first time a good song sounded like a good song, Boulevard of Broken Dreams-Wonderwall? What about Take Me Out-Paralyzer? The point is, not a big deal.

So anyways, the song has a nice buildup. It is a little slow, and the payoff may be less than satisfying, but Linkin Park is clearly going for a soft rock sound, to go in some background somewhere. Some people may like the sound, like soft rock fans, but fans of Linkin park will be like, WTH? ""In The End"" this is not. The vocals suit the song, the lyrics are good. Are they trying to go for a love song or something?

Overall, try first, maybe buy if you like. For me, it's just another song on radio I could really care less about. And definitely not one you want to hear all the time. Maybe every once in a while, but that's it.",
,B0011Z4YB4,-1,1,5,you feel so helpless.,
,B0011Z4YB4,-1,1,5,Hit,
,B0011Z4YB4,1,-1,3,no review,
,B0011Z4YB4,-1,1,5,Woop Woop,
,B0011Z5IJG,-1,1,5,I don't really care for his music but I cannot get enough of this song.  Up there where the air is rare.  Great harmony and spectacular performance on this one track.,
,B0011Z5IJG,-1,1,5,Eric,
,B0011Z4Y6E,1,-1,3,"This was a gift, so I cannot comment.",
,B0011Z4Y6E,-1,1,5,:),
,B0011Z4ZGI,1,-1,3,"This was a gift, so I cannot comment.",
,B0011Z2Z4C,-1,1,5,Brings back memories,
,B0011Z2Z4C,-1,1,5,He knew he was A Star! Purple Rain Movie & Soundtrack confirmed it!,
,B0011Z2Z4C,-1,1,5,He is a star,
,B0011Z2YZW,1,-1,3,"I like this song. I know it's dated but it's just got a fun vibe to it. I'm sure Prince is known for alot of music since this cd, but it's still enjoyable.",
,B0011Z3ESI,-1,1,5,,
,B0011Z0WNS,-1,1,4,Okay,
,B0011Z0WNS,-1,1,5,"What can I say , it's Prince.",
,B0011Z0WNS,-1,1,5,Brings back memories,
,B0011Z0WNS,-1,1,5,It's Prince!,
,B0011Z0WNS,-1,1,5,no comment,
,B0011Z0WNS,-1,1,5,Hit,
,B0011Z0WNS,-1,1,5,I am what you don't understand,
,B0011Z4ZVI,-1,1,5,What can I say it's PRINCE !,
,B0011Z4WT8,1,-1,3,good,
,B0011Z4WT8,-1,1,5,"""In The End""

(It starts with one)
 One thing I don't know why
 It doesnt even matter how hard you try
 Keep that in mind, I designed this rhyme
 To explain in due time
 (All I know)
 Time is a valuable thing
 Watch it fly by as the pendulum swings
 Watch it count down to the end of the day
 The clock ticks life away
 (Its so unreal)
 Didnt look out below
 Watch the time go right out the window
 Trying to hold on but didn't even know
 I wasted it all just to watch you go

 I kept everything inside and even though I tried, it all fell apart
 What it meant to be will eventually be a memory of a time when...

 I tried so hard
 And got so far
 But in the end
 It doesn't even matter
 I had to fall
 To lose it all
 But in the end
 It doesn't even matter

 One thing, I don't know why
 It doesnt even matter how hard you try
 Keep that in mind, I designed this rhyme
 To remind myself how
 I tried so hard
 In spite of the way you were mocking me
 Acting like I was part of your property
 Remembering all the times you fought with me
 Im surprised it got so (far)
 Things aren't the way they were before
 You wouldnt even recognize me anymore
 Not that you knew me back then
 But it all comes back to me
 In the end

 You kept everything inside and even though I tried, it all fell apart
 What it meant to me will eventually be a memory of a time when...

 I tried so hard
 And got so far
 But in the end
 It doesnt even matter
 I had to fall
 To lose it all
 But in the end
 It doesnt even matter

 I've put my trust in you
 Pushed as far as I can go
 For all this
 Theres only one thing you should know
 I've put my trust in you
 Pushed as far as I can go
 For all this
 Theres only one thing you should know

 I tried so hard
 And got so far
 But in the end
 It doesnt even matter
 I had to fall
 To lose it all
 But in the end
 It doesnt even matter",
,B0011Z4WT8,-1,1,5,I had no other reason to get this song other than I was thinking of another Linkin Park song and thought hay this one is not bad either.,
,B0011Z4ZDQ,-1,1,5,"Twenty years ago, at the end of 1994, MTV counted down 100 music videos of 1994 and gave the number one video position to the song Basket Case by Green Day from the CD Dookie. I used a magnifying glass to study the picture art on the cover of the CD jewel case and found the caption: twisted dog sister. The blimp in the upper left corner of the picture on the CD cover has the message: BAD YEAR. The CD is round and does not have the entire message, but the art on the CD itself clearly has bombs that are called DOOKIE. This CD was released in 1994 during the transition from January to February, so MTV had many opportunities to play the song Basket Case during the year 1994, and I think a special thrill was beheld internally at the idea of giving myself the creeps and my mind plays tricks on me. Basket Case was the Martin Luther Stonehood of 1994 expressing itself in punk rock, and people who have forgotten are like Americans who lack Hegel circling the present with the depth of its past.",
,B0011Z3ETW,1,-1,3,In the white room with black curtains at the station....Classic Rock at its finest. I used to jam out to it on vinyl when I was young.,
,B0011Z3ETW,1,-1,1,"I love this song, but I never got it. I wish that I had.",
,B0011Z74IE,-1,1,5,what can I say? It's Prince...,
,B0011Z3ETW,-1,1,5,A+++,
,B0011Z74IE,-1,1,5,Jamming,
,B0011Z74IE,-1,1,5,#DOPECLASSICALBUM!!,
,B0011Z3ETM,-1,1,4,I bought this because I am learning the bass line,
,B0011Z74IE,-1,1,5,My childhood wrapped up in one album.,
,B0011Z74IE,-1,1,5,no comment,
,B0011Z3ETM,-1,1,5,"I'm glad to get this song as originally recorded, but still frustrated with Amazon's download process that tries to push their cloud player and fails to download to iTunes without significant hassles. In order to get Amazon downloads properly into iTunes, I must try several times to download, then manually find the file and set up folders..",
,B0011Z74IE,-1,1,4,Ty,
,B0011Z74IE,-1,1,5,Hit,
,B0011Z5KBC,-1,1,5,Bring me to tears,
,B0011Z5KBC,-1,1,5,Blast from the past!!!,
,B0011Z5KBC,1,-1,3,"Used for memorial video after loved one's death, and it worked great.  The family loved it and found it very comforting.",
,B0011Z5KBC,-1,1,4,I'm a lover of this type of music. I get the MP3 downloads which hasn't been the best with Amazon's Downloading device this past 4 months which is why I knocked a star off.,
,B0011Z760U,-1,1,5,#DOPECLASSICALBUM!!,
,B0011Z76GE,1,-1,1,"I was a cashier on Junior's 4th floor shoes at Macy's Herald Square in Manhattan.  I had mad fun, actually working at my favorite department store.  There was this playlist that played nonstop.  This was one of the tunes on it. Sean Paul is mad fine.  A spanish guy from Jamaica.  Dancehall had come in style since I was a high school student.  One of the names mentioned in the song is ""Rebekah,"" that's me, which is why I love it.  ""Rebekah, Joanna, Donna, Annabella, and Jodi.""  These are the names of the sexy women he mentions in ""Get Busy.""  I don't know if ""Kana Kana"" counts as a name.
The beats in ""Get Busy"" are pretty fast, terribly abrupt, and choppy. There is that syncopated constant short clap beat throughout the song in addition to that daydream um....sound.  He rhymes pretty fast.  Jamaican patwa is quick.  He says, ""it's all good girl,"" making it a feel good song.  Sean Paul is good peoples!",
,B0011Z74C0,1,-1,3,thanks,
,B0011Z74C0,1,-1,3,"This was a gift, so I cannot comment.",
,B0011Z76XW,-1,1,4,oldie and goodie,
,B0011Z76XW,-1,1,5,This is is a classic to me and many of my friends from the era. Nothing like the instrumental of Green Onions. Never tired of it in the 60s-70s and love it today even more since there is no music anymore......... just computer generated noise.,
,B0011Z77TA,-1,1,5,TY,
,B0011Z77TA,-1,1,5,: ),
,B0011Z77TA,-1,1,5,"Afer I downloaded another song by G. Barkley( Who's gonna save my soul) I remembered this diddy, so I got this one too. Only thing I don't like is prior song I bought was recorded very low and this one very loud, so when I use my play list have to crank one and then run back n lower volume for 2nd song, which kinda suc*s.",
,B0011Z77TA,-1,1,5,"Love the song ""Crazy"" by Gnarls Barkley, but couldn't remember the name of the performer.  Not to worry:  my IHOP waiter knew it right off.  I was in Gatlinburg, where my cell service was not too good.  The first time it downloaded it did not do so correctly.  So I received an email warning me of this problem.  The next time I looked (later in the day). without any further action on my part the song had downloaded perfectly.",
,B0011Z77TA,1,-1,3,This is a fine song my son wanted it and thought it would be fun but once we got it he was over it.  LOL children!,
,B0011Z764Q,1,-1,3,"I enjoy cultural complexities, and here is one on point for this (in)famous song. The Catholic pop music critic Mark (""Marky') White has opined that this reaches up there with the greatest human spiritual achievements in culture apparently:

""Wait a Minute. Prince.
May 6, 2011 by frmarkdwhite
In an idle moment, I busted out a few tracks from the first Batman movie soundtrack, just to re-live the time. Listening took me back to those heady days of cassette tapes, and a crystalline realization left me humbled like a man in front of Niagara Falls:

Let's reflect for a moment--

Between 1982 and 1987, Prince came out with 1999, Purple Rain, Around the World in a Day, Parade, and Sign o' the Times.

Pause. Taking it in...

Do you realize how many songs are included here that are necessary elements of the cosmos?

By my count, at least twelve.

This is the most amazing thing that has ever been done.

If the man had only produced Purple Rain, that would be the most amazing thing that has ever been done.

...Can we really doubt, you know, the Almighty Hand?

No.""

Since the author is a great fan of Thomists like Ralph McInerny, let us note that this must be another Summum Bonum.",
,B0011Z77TA,1,-1,3,Has a nice beat and is easy to dance to. I give it a rating based upon my tastes. Your mileage may differ!,
,B0011Z764Q,1,-1,3,ok,
,B0011Z764Q,-1,1,4,My kidn of music. Throwback in memory of Prince.,
,B0011Z764Q,1,-1,3,"...of the 80s and Belgium.  One of my troops was a big Prince fan and he played this album when we were in the office.  I already had a couple of Prince's greatest hits albums, but this song wouldn't play because of a bad spot on the CD; so I downloaded it from Amazon to replace it on my computer.",
,B0011Z762I,-1,1,5,"Um, Prince....",
,B0011Z8OFG,-1,1,5,song,
,B0011Z8OFG,1,-1,3,Good,
,B0011Z762I,-1,1,4,Prince :(,
,B0011Z764Q,-1,1,5,This is Prince's anthem song that made his career what it was.  I have added this song to my Prince collection.,
,B0011Z8OFG,-1,1,5,xlint,
,B0011Z764Q,-1,1,5,Ordered because I grew up listening to his music,
,B0011Z8OFG,1,-1,3,good,
,B0011Z8OFG,-1,1,4,"Should have the starting ""screw ups"" deleted. Other than that, good song.",
,B0011Z762I,-1,1,4,been there done that,
,B0011Z8OFG,-1,1,5,REMINDS ME OF MY SKYDIVING DAYS,
,B0011Z762I,-1,1,5,no comment,
,B0011Z762I,1,-1,3,no review,
,B0011Z8OFQ,1,-1,1,Love her voice,
,B0011Z764Q,-1,1,5,memories,
,B0011Z764Q,-1,1,4,1,
,B0011Z8RHQ,-1,1,4,1,
,B0011Z764Q,-1,1,5,Hit,
,B0011Z764Q,1,-1,3,no review,
,B0011Z8O2O,-1,1,5,Bonita cancion,
,B0011Z8RHQ,1,-1,3,ok,
,B0011Z8RHQ,-1,1,5,"Nothing like the original artist's version!  Buddy Hacket and others just can't get it down like Picket did.  There is only one original, el primo,  Mustang Sally.",
,B0011Z8RHQ,-1,1,4,I'm a lover of this type of music. I get the MP3 downloads which hasn't been the best with Amazon's Downloading device this past 4 months which is why I knocked a star off.,
,B0011Z8O2O,-1,1,5,Touches a chord in me every time I hear it. He puts emotion into it.,
,B0011Z8O2O,1,-1,3,"This was a gift, so I cannot comment.",
,B0011Z8O2O,-1,1,5,:),
,B0011Z8O2O,-1,1,5,I don't remember downloading this song so I guess I'll have to go back listen to it again.,
,B0011Z8PU0,-1,1,5,no comment,
,B0011Z7M2C,-1,1,5,Mp-3,
,B0011Z768M,-1,1,5,#DAJAM!!!!!!!!!!!,
,B0011Z8OX8,-1,1,4,as expected,
,B0011Z8OX8,-1,1,5,throwback,
,B0011Z7448,-1,1,4,"I downloaded 3 songs after listening to this album.  Granted, the album was really good, however the 3 I downloaded were the only songs worth listening to more than once or twice. My advice: listen to the album samples first.",
,B0011Z8PXC,1,-1,3,This song is well worth the download and minimum cost to own. Would suggest this to all listeners not sure if I'd buy the whole album,
,B0011Z8PXC,-1,1,4,Planing on giving it to my grandaughter for Christmas.,
,B0011Z8PXC,-1,1,5,It was a song that brought back memories,
,B0011Z8PXC,-1,1,5,Clasic.,
,B0011Z8NSY,1,-1,3,no review,
,B0011Z8NSY,-1,1,5,takes me back,
,B0011Z94L4,-1,1,4,I'm a lover of this type of music. I get the MP3 downloads which hasn't been the best with Amazon's Downloading device this past 4 months which is why I knocked a star off.,
,B0011Z94L4,-1,1,4,The only drawback of this artist is when he shot someone. Hence the deduction of one star.  But he was an excellent entertainer.,
,B0011Z94CI,-1,1,5,"In my other reviews I have stated that PANTERA is number one... AMON AMARTH is number two DISTURBED is number three.  NOTE to all, BLACK SABBATH/OZZY is not on the list because I do not feel that GOD'S should be listed as Number one or two.  THEY ARE THEIR OWN CATAGORY!",
,B0011Z8NVG,-1,1,5,I like the old time songs better listing to then the newer stuff you can understand the music and what they are saying,
,B0011Z78V2,-1,1,5,Ok.,
,B0011Z78V2,-1,1,5,Electrifying performance by Otis Redding,
,B0011ZN4TM,1,-1,3,"tamia has a beautiful voice and the song is wonderful WITHOUT the rap artist
next time i buy this song it will be with only tamia singing",
,B0011Z8RUS,-1,1,4,"Great stuff when in a time of not so great ruled. The photo? Not so....the words ""lighten up "" ring loud and clear.....",
,B0011ZP94K,-1,1,5,Showing my Age!!!,
,B0011Z76UA,-1,1,4,1,
,B0011Z76UA,-1,1,5,"I ordered this song because i liked it. this is my obligated review. At least you get to sample the music like at the Virgin record store before you buy so i'm not sure if I could have a complaint...unless it's rap music, modern day rap then i wouldn't be purchasing it...just complaining",
,B0011ZP544,-1,1,5,anointed,
,B0011ZT522,-1,1,5,I've heard this on the radio a thousand times and decided it was time to add it to my collection.,
,B0011ZP364,-1,1,5,TY,
,B0011ZR7V8,-1,1,5,I love songs start innocently enough with a single guitar and lone vocal then let you have it a third of the through. Not heavy but hard enough to get your head moving. It made my Workout playlist.,
,B0011ZR7V8,1,-1,3,My children like this very much - they enjoyed the album and found it very easy to download (first time to download music),
,B0011ZW7G8,1,-1,3,"To know that Prince is a Joni Mitchell fan, mainly from when he name drops her in dorothy parker, you understand why it was important for him to do the tribute one of the reviewers had pointed out there where better contemporaries of hers that had great material an I agree, but this was based off his personal fondness for her work.",
,B0011ZT5MM,-1,1,5,"If you have ever had that feeling like you could just explode, implode, spontaneously combust... Then this is your cure.",
,B0011ZYPWM,-1,1,5,Thumbs up! ,
,B00120EDBY,1,-1,3,Good music,
,B00120EDBY,1,-1,3,It is okay.  It was the kind of music I thought it would be.,
,B00120EDBY,1,-1,3,"Great song to inspire people &help them through their day by listening to  MY SHOW ON KGLP.ORG  Don't worry, be happy! show.",
,B0012251CW,1,-1,3,"High School tune, never figured them to be right but.....",
,B0012251OK,-1,1,4,"Quick buying on the computer, downloading not so bad. Once again, issues getting to iTunes or Windows Media. But I think that's a computer bug.",
,B001226FHM,1,-1,3,nice,
,B001226FHM,-1,1,5,"If you don't like the ""Polar Express"" and this song, then we feel sorry for you.",
,B0012236SS,1,-1,3,"Some good, 80's era synth-pop material - mostly upbeat including the well-known ""People are people"" song. Dave Gahan's vocals are sharp and the synth spot on.",
,B00121BSFC,1,-1,3,"Why, when you have a strong wifi signal, is there a bunch of buffering interrupting your downloaded song? This is something that needs to be fixed before I download another song or cd from Amazon.

The Newsboys never disappoint. Shine is fun to listen to and very upbeat.",
,B0012269SC,-1,1,4,I still haven't figured out why it is not on my Kindle device. I already paid for it. What happened ?,
,B0012269SC,-1,1,5,I remember watching the video for this song on MTV as a teen. Jane made me not wanna fall in love. She rocks!,
,B001223DSG,1,-1,3,Great artist....like this song...brings back good memories of the 70's...,
,B001223DSG,-1,1,5,It stands up to the test of time.,
,B001223DSG,-1,1,5,Memories,
,B001227HXS,1,-1,3,like,
,B001227HXS,-1,1,5,I bought the track for a dvd I was making.  I used it for background music for some pictures from when I was a girl.,
,B001225A82,1,-1,3,GOOD!,
,B001227ZBC,-1,1,4,"i bought this record because, not only did I like it initially, but and being deeply hurt by my first husband, it was at that time that I realized just how thin that line really was. Years later he asked for forgiveness and I forgave him because I realized what he said was True and that we were both young and stupid. we were a long way from home and lacked guidance from both our parents or other adults that could have provided council. Even though I had some council but at that time that pain was greater than I could bear",
,B001226JXM,1,-1,3,"I like the 1980's a lot. This wasn't my favorite song from the 80's,but its my favorite song by Inxs. I like a lot of 80's songs.",
,B00122909W,1,-1,3,good,
,B001227O86,1,-1,3,good song but did not purchase for myself.  for someone else to hear . keep it coming amazon will continue to buy,
,B001229C18,-1,1,5,I heard this in either a movie or video game and came across it on Pandora Radio. I can't figure out where I heard it but it is awesome!,
,B001229C18,-1,1,5,Clubbed To Death [Kurayamino Variation] was something I heard everyone use for background to this or that.  Download was easy and immediate.,
,B001226F2W,-1,1,5,"wow! i have heard this song so many times in movies and tv shows that i just had to have it in my music playlist! the last straw was when i recently saw an episode of ""the wonder years"" on netflix.

i am not so sure how the long version, and the single version of this song differ. i guess i will never know unless someone that i know has purchased the single version. in this version, a guys says something from the beginning before the actual song begins and there is a long solo with a distorted type of voice towards the end. i found that kind of weird and not quit sure if that is how it is supposed to sound like. very difficult to say since music nowadays have that distorted voice in it too. maybe someone will let me know. :)",
,B001226F2W,-1,1,4,"I like the original version of the classic song, but as the saying goes, sometimes more it too much.  I guess they thought making it longer would be better for FM play or to have something to pack on a CD, but really, the instrumental bridge seems like it goes on forever.....",
,B0012298LC,-1,1,5,https://images-na.ssl-images-amazon.com/images/I/51Sqij0rQEL._SS300_.jpg,
,B0012298LC,-1,1,5,Pathos every time I hear it.,
,B0012298LC,-1,1,5,Tear jerker,
,B00122A8HU,1,-1,3,Pretty,
,B0012298LC,1,-1,3,Again I purchased this song to a friend of mine who absolutely loves all the versions of this particular tune.,
,B00122A23K,-1,1,5,:),
,B00122A23K,-1,1,5,Give it a listen,
,B00122A23K,1,-1,3,Good,
,B00122A0UA,-1,1,4,this one was better.....but one of the songs I paid for was missing the last 35 seconds....not happy.....,
,B00122A0UA,1,-1,1,"This mp3 sounds great so my complaint is not about sound quality. However, this song is usually presented as a pairing 'This Beat Goes On/Slippin' To Glide' and it usually happens in a seemless manner. These songs are cult classics and I'm sure the fans out there would love these to be presented in the normal seemless manner. To me it seems like breaking them in two is just a ploy to generate extra revenue. Still, I'm sure fans would pay $2 to have this be one peerless piece of music. I will compare this this to ZZ Top's 'Waitin' The Bus/Jesus Left Chicago' or Queen's 'We Will Rock You/We Are The Champions' - you really shouldn't hear one without the other.",
,B0012288VS,-1,1,5,Everybody say ho!,
,B0012288VS,1,-1,3,"Bought it since it was ranked #2 on the Rolling Stone ""Best Of"" list.  It is a classic, I guess, but might have to listen to it more to extract why it was rated so highly.",
,B001226HUC,-1,1,5,"Depeche Mode isn't usually a group flying on the radar... but this tune.. which I thought was entitled 'Here In My Arms' or 'All I ever needed (or wanted)'.. has a odd jammy beat.. that kinda twists and turns and twists right back to where it began.. off the wall keyboards and vocals make for a tune that oddly sounds in harmony with ""The Promise"" by When In Rome.... ""Words are meaningless and forgettable.... words are very ....unnecessary.. they can only do harm"" Solid 'A' effort",
,B00122B4UK,-1,1,4,Human interaction has not been as great as the idea of human engineering paving paradise to put up a parking lot with a swing hot spot. A society based on having so much entertainment to sell that it would like to toss everything else in the trash so people are not distracted by memories when they should be sleeping produced benzodiazepines to be the perfect hypnotic aspect of who we are.,
,B00122A1H2,-1,1,5,"If she were on American Idol, she would win going away! On the other hand, why would she go on such a sham of a show!",
